{
  "$schema":"https://json-schema.org/draft/2020-12/schema","$id":"https://example.invalid/aica/schemas/control-profile.schema.json","title":"AICA Control Profile","type":"object","required":["profile_id","title","version","published","disclaimer","sources","summary","controls","objectives"],"properties":{"$schema":{"type":"string"},"profile_id":{"type":"string"},"title":{"type":"string"},"version":{"type":"string"},"published":{"type":"string","format":"date-time"},"disclaimer":{"type":"string"},"sources":{"type":"object"},"summary":{"type":"object","required":["controls","nist_controls","custom_ai_controls","objectives","automated","hybrid","manual"]},"controls":{"type":"array","minItems":25,"maxItems":25,"items":{"type":"object","required":["id","source","title","family"],"additionalProperties":false,"properties":{"id":{"type":"string"},"source":{"type":"string"},"title":{"type":"string"},"family":{"type":"string"}}}},"objectives":{"type":"array","minItems":35,"maxItems":35,"items":{"$ref":"core-contracts.schema.json#/$defs/controlObjective"}}}
}
