{
  "$schema": "../../schemas/control-profile.schema.json",
  "profile_id": "AICA-STUDENT-1.0",
  "title": "Azure AI Continuous Assurance Student-Cost Profile",
  "version": "1.0.0",
  "published": "2026-05-15T12:00:00Z",
  "disclaimer": "Continuous internal-assurance and audit-readiness simulation; not a certification, attestation, or independent audit.",
  "sources": {
    "nist_sp_800_53": "Revision 5.2.0",
    "nist_sp_800_53a": "Revision 5.2.0",
    "oscal": "1.2.2"
  },
  "summary": {"controls": 25, "nist_controls": 20, "custom_ai_controls": 5, "objectives": 35, "automated": 19, "hybrid": 8, "manual": 8},
  "controls": [
    {"id":"AC-2","source":"NIST SP 800-53","title":"Account Management","family":"Access Control"},
    {"id":"AC-3","source":"NIST SP 800-53","title":"Access Enforcement","family":"Access Control"},
    {"id":"AC-6","source":"NIST SP 800-53","title":"Least Privilege","family":"Access Control"},
    {"id":"IA-2","source":"NIST SP 800-53","title":"Identification and Authentication (Organizational Users)","family":"Identification and Authentication"},
    {"id":"IA-5","source":"NIST SP 800-53","title":"Authenticator Management","family":"Identification and Authentication"},
    {"id":"AU-2","source":"NIST SP 800-53","title":"Event Logging","family":"Audit and Accountability"},
    {"id":"AU-6","source":"NIST SP 800-53","title":"Audit Record Review, Analysis, and Reporting","family":"Audit and Accountability"},
    {"id":"AU-12","source":"NIST SP 800-53","title":"Audit Record Generation","family":"Audit and Accountability"},
    {"id":"CA-7","source":"NIST SP 800-53","title":"Continuous Monitoring","family":"Assessment, Authorization, and Monitoring"},
    {"id":"CM-2","source":"NIST SP 800-53","title":"Baseline Configuration","family":"Configuration Management"},
    {"id":"CM-3","source":"NIST SP 800-53","title":"Configuration Change Control","family":"Configuration Management"},
    {"id":"CM-6","source":"NIST SP 800-53","title":"Configuration Settings","family":"Configuration Management"},
    {"id":"CP-9","source":"NIST SP 800-53","title":"System Backup","family":"Contingency Planning"},
    {"id":"IR-4","source":"NIST SP 800-53","title":"Incident Handling","family":"Incident Response"},
    {"id":"RA-3","source":"NIST SP 800-53","title":"Risk Assessment","family":"Risk Assessment"},
    {"id":"RA-5","source":"NIST SP 800-53","title":"Vulnerability Monitoring and Scanning","family":"Risk Assessment"},
    {"id":"SA-11","source":"NIST SP 800-53","title":"Developer Testing and Evaluation","family":"System and Services Acquisition"},
    {"id":"SC-7","source":"NIST SP 800-53","title":"Boundary Protection","family":"System and Communications Protection"},
    {"id":"SC-8","source":"NIST SP 800-53","title":"Transmission Confidentiality and Integrity","family":"System and Communications Protection"},
    {"id":"SI-4","source":"NIST SP 800-53","title":"System Monitoring","family":"System and Information Integrity"},
    {"id":"AI-GV-01","source":"AICA","title":"AI Use Governance and Accountability","family":"AI Governance"},
    {"id":"AI-DP-01","source":"AICA","title":"Grounding Data Provenance and Protection","family":"AI Data Protection"},
    {"id":"AI-AC-01","source":"AICA","title":"AI Tool Authorization and Confirmation","family":"AI Access Control"},
    {"id":"AI-TE-01","source":"AICA","title":"AI Evaluation and Release Gate","family":"AI Testing"},
    {"id":"AI-MO-01","source":"AICA","title":"AI Monitoring and Escalation","family":"AI Monitoring"}
  ],
  "objectives": [
    {"id":"AC-2.1","control_id":"AC-2","objective":"Only approved managed identities and reviewer personas are active in project scopes.","method":"HYBRID","subject_selector":"project role assignments and managed identities","cadence":"daily","evidence_requirements":["Azure Resource Graph identity inventory","Azure RBAC assignment export","owner review"],"owner":"Identity Owner","limitations":"Automated inventory cannot establish business need without owner review."},
    {"id":"AC-2.2","control_id":"AC-2","objective":"Account ownership and quarterly access review decisions are documented.","method":"MANUAL","subject_selector":"all simulated personas and workload identities","cadence":"quarterly","evidence_requirements":["signed access review workpaper"],"owner":"Identity Owner","limitations":"Solo-project roles are simulated and are not independent."},
    {"id":"AC-3.1","control_id":"AC-3","objective":"Wrong identities receive HTTP 403 on private command endpoints.","method":"AUTOMATED","subject_selector":"assurance API command routes","cadence":"per release","evidence_requirements":["authorization integration-test trace"],"owner":"API Owner","limitations":"Synthetic test identities do not prove tenant-wide enforcement."},
    {"id":"AC-3.2","control_id":"AC-3","objective":"Command authorization design enforces append-only decisions and optimistic concurrency.","method":"HYBRID","subject_selector":"review and exception commands","cadence":"per change","evidence_requirements":["API contract test","reviewer design inspection"],"owner":"Assurance Owner","limitations":"Reviewer inspection is required for semantic authorization."},
    {"id":"AC-6.1","control_id":"AC-6","objective":"Project role assignments contain no owner-equivalent or wildcard data-plane grants.","method":"AUTOMATED","subject_selector":"project resource groups","cadence":"daily","evidence_requirements":["RBAC assignment export","least-privilege rule output"],"owner":"Cloud Owner","limitations":"Inherited assignments above assessed scopes are reported separately."},
    {"id":"AC-6.2","control_id":"AC-6","objective":"Each workload identity privilege has a documented task need and removal condition.","method":"MANUAL","subject_selector":"assistant, collector, console, deploy, and Sentinel identities","cadence":"quarterly","evidence_requirements":["identity responsibility matrix","owner attestation"],"owner":"Cloud Owner","limitations":"Attestation does not test effective permission."},
    {"id":"IA-2.1","control_id":"IA-2","objective":"Interactive private-console access requires Entra authentication and MFA-capable policy.","method":"AUTOMATED","subject_selector":"private console authentication configuration","cadence":"daily","evidence_requirements":["authentication settings export","negative access test"],"owner":"Identity Owner","limitations":"Conditional Access policy effectiveness may require tenant-level evidence outside project scope."},
    {"id":"IA-5.1","control_id":"IA-5","objective":"Workloads use managed identity or OIDC and repository scans detect no stored credentials.","method":"HYBRID","subject_selector":"deploy and runtime authentication paths","cadence":"per commit","evidence_requirements":["secret scan","federated credential configuration","reviewer inspection"],"owner":"DevSecOps Owner","limitations":"Scanning cannot prove a secret was never disclosed elsewhere."},
    {"id":"AU-2.1","control_id":"AU-2","objective":"Required security, assurance, authentication, tool-use, and configuration-change event categories are configured at every in-scope service.","method":"AUTOMATED","subject_selector":"Container Apps, Storage, Key Vault, Foundry, API","cadence":"daily","evidence_requirements":["approved event taxonomy","diagnostic-settings inventory","application telemetry schema test"],"owner":"Monitoring Owner","limitations":"Configuration evidence does not prove downstream query usefulness."},
    {"id":"AU-2.2","control_id":"AU-2","objective":"The event taxonomy remains sufficient for stated threats and privacy constraints.","method":"HYBRID","subject_selector":"event taxonomy and sample queries","cadence":"semiannual","evidence_requirements":["event taxonomy","query samples","review decision"],"owner":"Monitoring Owner","limitations":"Event selection adequacy requires judgment."},
    {"id":"AU-6.1","control_id":"AU-6","objective":"A reviewer assesses anomalous events, failed collections, and rejected tool escalations.","method":"MANUAL","subject_selector":"weekly assurance and security review","cadence":"weekly","evidence_requirements":["signed monitoring review workpaper"],"owner":"Simulated Security Reviewer","limitations":"Reviewer is a simulated persona operated by the project author."},
    {"id":"AU-12.1","control_id":"AU-12","objective":"Correlation IDs, actor pseudonyms, outcomes, and timestamps are present without routine prompt text.","method":"AUTOMATED","subject_selector":"assistant and assurance telemetry samples","cadence":"per release","evidence_requirements":["telemetry schema validation","redaction test"],"owner":"Application Owner","limitations":"Sampling may miss rare malformed events."},
    {"id":"CA-7.1","control_id":"CA-7","objective":"Scheduled and change-triggered assessments run with no false pass on missing evidence.","method":"AUTOMATED","subject_selector":"assessment pipeline","cadence":"daily and per change","evidence_requirements":["run manifests","negative collection tests"],"owner":"Assurance Owner","limitations":"A successful job does not establish all manual objectives."},
    {"id":"CA-7.2","control_id":"CA-7","objective":"Monitoring cadence, coverage, freshness, and trend are periodically reviewed.","method":"HYBRID","subject_selector":"continuous monitoring strategy","cadence":"monthly","evidence_requirements":["coverage report","review decision"],"owner":"Assurance Owner","limitations":"Fourteen-day sample is illustrative, not long-term evidence."},
    {"id":"CM-2.1","control_id":"CM-2","objective":"Deployed resources match compiled, version-controlled infrastructure baselines.","method":"AUTOMATED","subject_selector":"project resource groups","cadence":"per deploy","evidence_requirements":["Bicep build digest","ARM What-If output","Resource Graph inventory"],"owner":"Cloud Owner","limitations":"Platform-managed properties are normalized before comparison."},